STRING_ID,English,Translation,Spanish,Chinese,German,Brazilian,French,Russian,Korean
Tut_TargetSomethingJ_4,"Use the right stick to aim your target at the Computer, and press",,"Usa el joystick derecho para apuntar a tu objetivo en el ordenador, y pulsa",使用右摇杆瞄准计算机，然后按下,"Nutze den rechter Stick, um auf den Computer zu zielen, und drücke","Use o controle direito para mirar no seu alvo no Computador, e pressione",Utilisez le joystick droit pour placer votre cible sur l'Ordinateur et appuyez sur,"Используй правый джойстик, чтобы прицелиться в компьютер, и нажми",오른쪽 아날로그 스틱을 사용하여 컴퓨터에서 목표물을 조준하고 다음을 누릅니다.
Tut_TargetSomethingJ_4_NS,"Use the right stick to aim your target at the Computer, and press",,"Usa el palanca derecho para apuntar a tu objetivo en el ordenador, y pulsa",使用右摇杆瞄准计算机，然后按下,"Nutze den rechter Stick, um auf den Computer zu zielen, und drücke","Use o botão analógico da direita para mirar no seu alvo no Computador, e pressione",Utilisez le stick droit pour placer votre cible sur l'Ordinateur et appuyez sur,"Используй правый джойстик, чтобы прицелиться в компьютер, и нажми",오른쪽 아날로그 스틱을 사용하여 컴퓨터에서 목표물을 조준하고 다음을 누릅니다.
Tut_OpenQuestSheet,"I'm going to send you on a little trial mission.  To see what it is, press",,"Te asignaré una pequeña misión de prueba. Para ver de qué se trata, pulsa",我会交给你一个小小的测试任务。要查看任务内容，请按,"Ich werde auf eine kleine Testmission schicken. Um zu sehen, worin sie besteht, drücke","Mandarei você em uma pequena missão de teste. Para visualisá-la, pressione","Je vais vous envoyer dans une petite mission d'essai. Pour voir ce que c'est, appuyez sur","У меня есть для тебя тестовое задание. Чтобы узнать, в чем оно состоит, нажми","작은 시험 미션을 보낼게요. 무엇인지 보려면, 다음을 눌러요."
Tut_OpenObjectInfo,"Someone is on guard duty in the building past this fence.  To see more info on him, hold",,"Hay un guardia vigilando el edificio detrás de esta cerca. Para ver más información sobre él, mantén pulsado",这道围栏后面的大楼有人在站岗。要查看他的更多信息，按住,"Jemand hat Wachdienst im Gebäude hinter diesem Zaun. Um weitere Informationen über die Wache zu sehen, halte","Alguém está de guarda no edifício depois desta cerca. Para ver mais informações sobre ele, pressione","Il y a un garde dans le bâtiment derrière ce portail. Pour avoir plus d'informations sur lui, maintenez","Кто-то охраняет здание за этим забором. Чтобы побольше узнать о нем, удерживай",누군가 이 울타리 너머 건물에서 경비 근무를 서고 있어요. 그에 대한 자세한 정보를 보려면 다음을 눌러요.
Tut_UseItemInToolbar_1,"""Hostile"".  It looks like he won't be too happy to see you.  And by the way, if someone's name is Yellow, it means they own the property.  I'm teleporting you a",,"""Hostil2. Parece que no estará muy feliz de verte. Y por cierto, si el nombre de alguien se ve amarillo, significa que es el dueño de la propiedad. Te teletransportaré a",“敌对”。看来他不会对你有什么好脸色。对了，如果有人的名字用黄色显示，这说明他是房主。我给你传送个,"„Feindlich“. Er wird wohl nicht so glücklich sein, dich zu sehen. Und übrigens, wenn der Name einer Person gelb angezeigt wird, bedeutet das, dass diese Person das Grundstück besitzt. Ich teleportiere dir einen","""Hostil"". Parece que ele não ficará muito feliz em ver você. E, a propósito, se o nome de alguém estiver Amarelo, significa que ele é o dono da propriedade. Teletransportarei para você um","""Hostile"". On dirait qu'il ne sera pas très heureux de vous voir. Au fait, si le nom de quelqu'un est en jaune, cela veut dire qu'il possède la propriété. Je vous téléporte un","«Враждебный». Похоже, он не будет рад тебе. Кстати, если чье-то имя написано желтым, это означает, что этот человек — хозяин. Я телепортирую тебе","""적대적"". 그는 당신을 보는 게 별로 기쁘지 않은 것 같아요. 그리고 그건 그렇고, 누군가의 이름이 옐로우라면, 그들이 이 부동산을 소유하고 있다는 걸 뜻하지요. 내가 다음을 당신에게 텔레포트할게요."
Tut_UseItemInToolbarK_2,Try using it from your toolbar: Press the number key that corresponds to its slot.,,Intenta usarlo desde tu barra de herramientas: pulsa la tecla numérica que corresponda con su casillero.,来试试从工具栏中使用它：按下工具栏栏位对应的数字键。,"Versuche, den Gegenstand aus deiner Symbolleiste zu verwenden: Tippe auf die Zifferntaste, die zum jeweiligen Slot gehört.",Tente usá-lo da sua barra de ferramentas: Pressione a tecla de número que corresponde ao seu slot.,Essayez de l'utiliser depuis votre barre de raccourcis : appuyez sur la touche numérotée correspondant à son emplacement.,"Попробуй использовать его с панели действий: нажми клавишу с цифрой, соответствующей номеру слота.",도구 모음에서 이것을 사용해 보세요. 슬롯에 해당하는 숫자 키를 누르세요.
Tut_UseItemInToolbarJ_2,Try using it from your toolbar: Press the D-Pad in the direction that corresponds to its slot.,,Intenta usarlo desde tu barra de herramientas: pulsa el pad direccional en la dirección que corresponda con su casillero.,来试试从工具栏中使用它：按下栏位对应的方向键。,"Versuche, den Gegenstand aus deiner Symbolleiste zu verwenden: Tippe auf dem D-Pad auf die Richtung, die zum jeweiligen Slot gehört.",Tente usá-lo da sua barra de ferramentas: Pressione o D-Pad na direção que corresponde ao seu slot.,Essayez de l'utiliser depuis votre barre de raccourcis : appuyez sur la direction du D-Pad correspondant à son emplacement.,Попробуй использовать его с панели действий: нажми соответствующую кнопку на крестовине.,도구 모음에서 이것을 사용해 보세요. 슬롯에 해당하는 방항으로 D 패드를 누르세요.
Tut_OutOfWallBypassers,Yeaaaah not quite.  Here's another one.,,"Síiiii, no del todo. Aquí hay otro.",哎，不行。这里还有一个。,"Jaaaaaaaa, nicht ganz. Hier ist noch einer.","Beeeeeem, não é bem assim. Aqui está mais um.","Ouaiiiiiiis, mais non. En voilà un autre.","Хм... Ну, почти. Держи еще один.",예에에에에 꼭 그렇지만은 않습니다. 다른 한 명이 있네요.
Tut_OpenRedDoor,"Typically, a red door means people don't want you in there.",,"Normalmente, una puerta roja significa que la gente no te quiere allí.",一般来说，红色的门表示非请莫入。,"In der Regel bedeutet eine rote Tür, dass die Leute dich nicht dort haben wollen.","Normalmente, uma porta vermelha significa que as pessoas não querem você por lá.","Normalement, une porte rouge indique qu'on ne veut pas que vous entriez.","Обычно, красная дверь означает, что люди внутри будут тебе не рады.","일반적으로, 빨간색 문은 사람들이 당신이 거기에 있는 걸 원하지 않는다는 의미입니다."
Tut_BeatUpAgent_1,"Meet our staff Bouncer!  He'll be playing the part of 'bad guy', but he's been instructed not to fight back under any circumstances.",,"¡Conozca a nuestro gorila contratado! Jugará la parte de 'chico malo', pero tiene instrucciones de no defenderse bajo ninguna circunstancia.",来认识一下我们的员工，保镖！他会扮演“坏人”，不过我已经给他下了命令，打死也不能还手。,"Das hier ist unser Türsteher-Mitarbeiter! Er wird die Rolle des ‚Bösewichts‘ übernehmen, aber er hat die Anweisung, unter keinen Umständen zu kämpfen.","Conheça o Segurança de nossa equipe! Ele interpretará o ""bandido"", mas ele foi instruído para não revidar sob qualquer circunstâncias.","Voici le videur de l'équipe ! Il va jouer le rôle du 'méchant', mais on lui bien dit de ne pas répliquer, quelles que soient les circonstances.","Познакомься, это наш штатный вышибала. Он сыграет роль плохого парня. Он получил инструкции не бить тебя, что бы не происходило.","스태프 바운서를 만나세요! 그가 '나쁜 놈' 역할을 할 것이지만, 어떤 상황에서도 반격하지 않도록 지시를 받았습니다."
Tut_BeatUpAgent_2,"Hello, nice to make your acquaintance!",,"¡Hola, es un placer conocerte!",你好，很高兴认识你！,"Hallo, schön dich kennenzulernen!","Olá, prazer em conhecê-lo!","Salut, content de faire votre connaissance !","Привет, приятно познакомиться!","안녕하세요, 만나뵙게 되서 반갑습니다!"
Tut_BeatUpAgent_3,"Rookie, feel free to wail on him as hard as you can.  He's a big guy, he can take it!",,"Novato, sientete libre de darle una buena golpiza. ¡Es un tipo grande, puede soportarlo!",菜鸟，拿出你吃奶的劲怼他吧。他块头大，受得了！,"Neuling, du kannst ruhig so hart auf ihn einschlagen wie du kannst. Er ist ein großer Kerl, er hält das aus!","Novato, sinta-se à vontade para bater nele com toda a sua força. Ele é grandão, vai aguentar!","Recrue, n'hésitez pas à lui foutre sur la tronche le plus fort possible. C'est un grand garçon, il peut encaisser !","Новобранец, вдарь ему как следует, он большой, выдержит!","루키, 마음껏 최대한 그를 세게 쳐봐. 그는 큰 녀석이야, 감당할 수 있어!"
Tut_BeatUpAgent_4,Ummmmmmm...,,Ummmmmmm...,呃~~~~,Ummmmmmm...,Ummmmmmm...,Mmmmmmh...,Ау-у-у...,음으으으으으...
Tut_BeatUpAgent_5,"Excuse me, but I don't recall agreeing to this.",,"Disculpe, pero no recuerdo haber acordado esto.",抱歉，但我不记得我同意过这事。,"Entschuldigung, aber ich kann mich nicht daran erinnern, dem zugestimmt zu haben.","Sinto muito, mas não lembro de ter concordado com isso.","Désolé, mais je ne me souviens pas avoir accepté ça.","Простите, я не соглашался на такое.","실례지만, 여기에 동의한 기억이 없어요."
Tut_BeatUpAgent_6,"When you signed your Resistance paperwork, perhaps you'll recall section 7C, which states ""Members are subject to any and all of the Resistance Leaders' illogical, dangerous and/or sadistic whims"".",,"Quizás recuerdes que en los papeles que firmaste al unirte a la Resistencia figuraba en la sección 7C que ""Los miembros están sujetos a los caprichos ilógicos, peligrosos y sádicos de los líderes de la Resistencia"".",或许你还记得抵抗组织合同的第 7C 小节，上面规定“成员需满足抵抗组织领袖的所有不合逻辑、危险和（或）虐待狂般的奇思妙想”。,"Vielleicht erinnerst du dich noch an Abschnitt 7C aus den Dokumenten, die du für den Widerstand unterschrieben hast. Dieser Abschnitt besagt: „Mitglieder unterliegen allen unlogischen, gefährlichen und/oder sadistischen Launen der Anführer des Widerstands“.","Quando você assinar sua papelada da Resistência, possivelmente você lembrará da seção 7C, que declara que ""Os membros estão sujeitos a todos os caprichos ilógicos, perigosos e/ou sádicos dos Líderes da Resistência"".","Dans les papiers de la Résistance que vous avez signé, il y a une section 7C qui indique ""les membres doivent se soumettre à toutes les volontés sadiques, dangereuses et/ou illogiques des chefs de la Résistance"".","Когда ты подписывал бумаги о вступлении в Сопротивление, в пункту 7В было написано: «Члены Сопротивления обязаны терпеть любое нелогичное, опасное и/или садистское поведение Лидеров».","저항군 서류에 서명할 때, 아마도 ""멤버들은 저항군 리더의 비논리적이거나 위험하거나 가학적인 변덕 모두 혹은 어느 것이든 당하기 쉽습니다.""라는 7C 항을 떠올릴 겁니다."
Tut_BeatUpAgent_7,"Well, I would have read that more carefully, but to be honest it was kind of impossible.",,"Bueno, lo hubiera leído con más cuidado, pero honestamente era algo imposible.",哎，我当时真该好好看看，不过老实说，那根本不可能。,"Nun, ich hätte diesen Abschnitt gern aufmerksamer gelesen, aber das war ehrlich gesagt ziemlich unmöglich.","Bem, eu deveria ter lido isso com mais atenção, mas, para ser honesto, era meio que impossível.","Mouais. J'aurais bien lu ça un peu plus sérieusement, mais pour être honnête : c'était impossible.","Ну, я бы прочитал все внимательно, но это было просто невозможно, если честно-то.","음, 그걸 좀 더 신중하게 읽을 걸, 하지만 솔직히, 불가능하긴 했어요."
Tut_BeatUpAgent_8,Did you guys REALLY need to write the entire document in braille?,,¿Había REALMENTE necesidad de escribir todo el documento en braille?,你们真的要全拿盲文写这份合同吗？,Musstet ihr denn WIRKLICH das ganze Dokument in Brailleschrift verfassen?,Vocês REALMENTE precisam escrever todo o do documento em braille?,Vous deviez VRAIMENT écrire tout le document en braille ?,Неужели и правда надо было писать ВЕСЬ документ шрифтом Брайля?,정말 점자로 전체 문서를 작성해야 했나요?
Tut_BeatUpAgent_9,"Yes, we're making efforts to be more inclusive and diverse.",,"Sí, nos estamos esforzando en ser más inclusivos y diversos.",对，我们正在努力让组织更加包容，更加多元化。,"Ja, wir bemühen uns um Integration und Vielfalt.","Sim, estamos nos esforçando para ser mais inclusivos e diversificados.",Oui. Nous faisons notre possible pour que l'organisation soit la plus ouverte et diverse possible.,"Да, это часть программы по обеспечению равных прав для всех.","예, 우리는 더욱 포괄적이고 다양하도록 노력을 기울이고 있어요."
Tut_BeatUpAgent_10,"Look, you have no right to allow some random guy off the street to take shots at me for the sake of some.. what did you call it, ""Tutorial""?",,"Mira, no tienes derecho a permitir que un tipo al azar de la calle me golpée solo por un... ¿cómo lo llamaste? ¿""Tutorial""?",听着，你没有权利为了那个……那个什么“教程”之类的玩意，就随便在街上找个人朝我开枪。,"Schau mal, du hast kein Recht darauf, irgendeinem Kerl von der Straße zu erlauben, auf mich zu schießen wegen irgendeines... wie hast du das genannt, „Tutorials“?","Olha, você não tem direito de permitir que um cara qualquer da rua tire fotos de mim por causa de um tal de... como é que você chamou ele, ""Tutorial""?","Écoutez, vous n'avez pas le droit de permettre à un type lambda trouvé dans la rue de me frapper pour un... vous appelez ça comment, déjà ? Un ""tutoriel"" ?","Короче, у вас нет никаких прав разрешать какому-то парню с улицы стрелять в меня в рамках... как это, «Вводного курса»?","이봐요, 거리에서 임의의 사람이 무언가를 위해 제게 총구를 돌리게 할 권리가 없어요... 이걸 뭐라 불렀죠, ""튜토리얼""?"
Tut_BeatUpAgent_11,"We can do whatever we want to you, we're the ones in charge!",,"Podemos hacer todo lo que le queramos, ¡nosotros estamos a cargo!",我们说了算，所以可以对你为所欲为。,"Wir können tun und lassen, was wir wollen, wir haben hier das Sagen!","Podemos fazer o que quisermos, somos nós que estamos no comando!",Nous pouvons faire ce que nous voulons de vous. C'est nous qui décidons !,"Мы можем делать все, что захотим! Мы главные!",우리가 당신에게 원하는 무엇이든 할 수 있어요. 우리가 맡고 있지요!
Tut_BeatUpAgent_12,"You know, this is the same sort of ridiculous authoritarian crap that the Mayor pulls...",,"Sabes, este es el mismo tipo de absurda basura autoritaria con la que nos cansa el Alcalde...",你知道吗？你这套独裁主义鬼话和市长一模一样……,"Weißt du, das ist genau so ein lächerlicher autoritärer Mist wie der, den der Bürgermeister abzieht...","Quer saber, esse é o mesmo tipo de autoritarismo ridículo do Prefeito...",Vous savez quoi ? Ce genre de saloperie fasciste aurait été digne du Maire...,"Это такая же авторитарная хрень, что и у мэра...","알다시피, 이것은 시장이 저지르는 우스꽝스러운 권위주의적 쓰레기 같은 일이지요..."
Tut_BeatUpAgent_13,"Stop being a wimp, you'll be fine!",,¡Deja de portarte como un cobarde! Estarás bien.,别畏畏缩缩了，你会安然无恙的！,"Hör auf rumzujammern, du schaffst das schon!","Deixe de covardia, você vai ficar bem!","Arrêtez d'être une mauviette, vous irez bien !","Ну хватит уже ныть, все будет ок!","그만 겁쟁이 같이 굴어, 당신은 괜찮을 거야!"
Tut_BeatUpAgent_14,"We gave you that sweet Hard Hat, remember?",,"Te dimos ese excelente casco, ¿recuerdas?",我们给过你一顶超酷的安全帽，记得吗？,"Wir haben dir diesen tollen Schutzhelm gegeben, weißt du noch?","Te demos aquele Capacete maneiro, lembra?","En plus, nous vous avons donné un super Casque de sécurité, n'est-ce pas ?",Мы же выдали тебе каску! Забыл?,"우리가 스윗한 안전모를 줬죠, 기억해요?"
Tut_BeatUpAgent_15,Fair enough.,,"Bien, vale.",好吧，有道理。,Das stimmt.,Muito bem.,"Mouais, c'est pas faux.",И то верно.,충분히 공평해요.
Tut_BeatUpAgentLine_1,Oh come on...,,"Oh, vamos...",哎，不是吧……,"Ach, komm schon...","Ah, vamos lá...","Oh, allez...",Да ла-адно!..,"오, 어서..."
Tut_BeatUpAgentLine_2,"Well, at least it's not the taser.",,"Bueno, por lo menos no es la pistola paralizante.",哎，还好不是电击枪。,"Nun, wenigstens ist es kein Taser.","Bem, pelo menos não é o taser.",Mouais. Au moins ce n'est pas le taser.,"Ну, это хотя бы не тазер.","음, 적어도 테이저는 아니군요."
Tut_BathroomLine_1,Aaaaaa!  Get out of here!,,¡Aaaaaa! ¡Largo de aquí!,啊啊啊！快给我出去！,Aaaaaa! Raus hier!,Aaaaaa! Saia daqui!,Aaaaaa ! Sortez de là !,А-а-а! Вали отсюда!,아아아아아! 나가버려!
Tut_BathroomLine_2,How unprofessional!,,¡Qué poco profesional!,真不专业！,Wie unprofessionell!,Que não profissional!,Quel manque de professionnalisme !,Как непрофессионально!,"음, 적어도 테이저는 아니군요."
Tut_MeleeTargetK,You can punch by clicking the left mouse in the direction of this loveable brute.,,Puedes hacer clic en el botón izquierdo del ratón en dirección a este adorable bruto para golpearlo.,对着这个可爱的大块头点击鼠标左键就可以攻击他。,"Du kannst boxen, indem du die linke Maustaste in die Richtung dieses liebenswerten Grobians zeigen lässt und klickst.",Você pode dar um soco clicando com o botão esquerdo do mouse na direção desse brutamontes amável.,Vous pouvez frapper en cliquant avec le bouton gauche dans la direction de cette adorable brute.,"Ты можешь ударить этого прекрасного качка, щелкнув левой кнопкой в его направлении.",이 사랑스런 짐승의 방향에서 마우스 왼쪽 버튼을 클릭하여 펀치를 날릴 수 있습니다.
Tut_MeleeTargetJ,You can punch this loveable brute by facing toward him and pressing,,Puedes golpear a este adorable bruto si miras hacia él y pulsas,面对这个可爱的大块头就可以攻击他，不过你得按着,"Um diesen liebenswerten Grobian zu boxen, drehst du dich zu ihm und drückst auf",Você pode dar um soco neste brutamontes amável virando para ele e pressionado,Vous pouvez frapper cette adorable brute en lui faisant face et en appuyant sur,"Ты можешь ударить этого прекрасного качка, посмотрев в его стороны и нажав",이 사랑스런 짐승에게 향하고 눌러서 이 짐승에게 펀치를 날릴 수 있습니다.
Tut_MeleeTargetWithWeapon,Now grab that weapon and give him a good whack!,,¡Ahora coge esa arma y dale un buen golpe!,拿起那件武器，狠狠教训他一顿！,Jetzt schnapp dir die Waffe und verpass ihm einen schönen Schlag!,Agora pegue aquela arma e dê uma lição a ele!,"Maintenant prenez cette arme, et mettez-lui une bonne torgnole !","Возьми это оружие и вдарь ему, как следует!",이제 그 무기를 잡고 그에게 세게 강타를 날리세요!
Tut_CycleWeaponK,Grab that Tranquilizer Gun and cycle to it using the Mouse Wheel,,Agarra esa pistola de tranquilizantes y búscala con la rueda del ratón para seleccionarla,拿起麻醉枪，使用鼠标滚轮循环选中它,Schnapp dir das Betäubungsgewehr und gelange mit dem Mausrad dahin,Pegue aquela Pistola de Tranquilizante e vá até ele usado a Roda do Mouse,Prenez le Tranquillisant et faites défiler vos armes jusqu'à lui grâce à la Mollette de la souris,Возьми ружье-транквилизатор и прокрути инвентарь до него с помощью колесика мышки,마취총을 잡고 마우스 휠로 탐색하세요!
Tut_CycleWeaponJ,Grab that Tranquilizer Gun and cycle to it using,,Agarra esa pistola de tranquilizantes y búscala para seleccionarla con,拿起麻醉枪然后循环选中它，方法是使用,Schnapp dir das Betäubungsgewehr und gelange dorthin mit,Pegue aquela Pistola de Tranquilizante e vá até ele usado,Prenez le Tranquillisant et faites défiler vos armes jusqu'à lui grâce à,Возьми ружье-транквилизатор и прокрути инвентарь до него с помощью,마취총을 잡고 다음을 사용하여 탐색하세요.
Tut_TranquilizeTargetK,Use the mouse to aim and shoot.  Put a few darts in him!,,Usa el ratón para apuntar y disparar. ¡Métele algunos dardos!,使用鼠标瞄准并射击。让他尝尝飞镖的滋味！,Benutze die Maus zum Zielen und Schießen. Verpass ihm ein paar Pfeile!,Use o mouse para mirar e atirar. Acerte alguns dardos nele!,Utilisez la souris pour viser et tirez. Collez-lui quelques fléchettes dans la couenne !,"Используй мышку, чтобы прицелиться и выстрелить. Ему потребуется несколько дротиков!",마우스를 사용하여 조준하고 쏘세요. 그에게 다트 몇 개를 던져요!
Tut_TranquilizeTargetJ,Use the right stick to aim.  Put a few darts in him!,,Utilizar el joystick derecho para apuntar. ¡Métele algunos dardos!,使用右摇杆瞄准。让他尝尝飞镖的滋味！,Benutze den rechter Stick zum Zielen. Verpass ihm ein paar Pfeile!,Use o controle direito para mirar. Acerte alguns dados nele!,Utilisez le joystick droit pour viser. Collez-lui quelques fléchettes dans la couenne !,"Используй правый джойстик, чтобы прицелиться. Потребуется несколько дротиков!",오른쪽 아날로그 스틱을 사용하여 조준하세요. 그에게 다트 몇 개를 던져요!
Tut_TranquilizeTargetJ_NS,Use the right stick to aim.  Put a few darts in him!,,Utilizar el palanca derecho para apuntar. ¡Métele algunos dardos!,使用右摇杆瞄准。让他尝尝飞镖的滋味！,Benutze den rechter Stick zum Zielen. Verpass ihm ein paar Pfeile!,Use o botão analógico da direita para mirar. Acerte alguns dados nele!,Utilisez le stick droit pour viser. Collez-lui quelques fléchettes dans la couenne !,"Используй правый джойстик, чтобы прицелиться. Потребуется несколько дротиков!",오른쪽 아날로그 스틱을 사용하여 조준하세요. 그에게 다트 몇 개를 던져요!
