STRING_ID,English,Translation,Spanish,Chinese,German,Brazilian,French,Russian,Korean
HatGoneEndingDialog2,"The city's denizens had no idea what to do without an all-powerful figure in office controlling their lives, and the city descended into chaos.",,"Los habitantes de la ciudad no tenían idea de qué hacer sin una figura todopoderosa en el poder que controlara sus vidas, y la ciudad se sumergió en el caos.",办公室里少了一个全能的人物来掌控他们的生活，这座城市的居民不知道该如何继续下去，因此城市陷入了混乱。,"Die Stadtbewohner wussten nicht, was sie ohne eine allmächtige Amtsperson tun sollten, die ihr Leben kontrollierte. So versank die Stadt im Chaos.",Os cidadãos da cidade não faziam ideia do que fazer sem uma figura toda-poderosa no poder controlando suas vidas e a cidade foi dominada pelo caos.,"Les habitants de la ville ne savaient plus quoi faire en l'absence de personnalité toute puissante à la tête de leurs vies, et la ville sombra dans le chaos.","Жители города понятия не имели, что делать без контролирующей их жизнь всесильной администрации, и город погрузился в хаос.",도시의 주민들은 그들의 삶을 통제하는 사무실에서 전능한 인물 없이 무엇을 해야 할지 전혀 몰랐으며 도시는 혼란에 빠져 들었습니다.
HatGoneEndingDialog3,"The Resistance members, finding themselves without an enemy to rally against, got all super depressed and existential.",,"Los miembros de la Resistencia, al encontrarse a sí mismos sin un enemigo contra el cual unirse, se pusieron súper deprimidos y con dudas existenciales.",抵抗组织的成员发现自己再也没有了反抗的对象，全都变得异常沮丧和恐慌。,"Die Mitglieder der Widerstandsbewegung, die keinen Feind mehr hatten, gegen den sie sich wenden konnten, wurden alle depressiv und machten sich Gedanken über den Sinn des Lebens.","Os membros da Resistência, sem um inimigo para lutarem contra, ficaram deprimidos e sem propósito.",Les membres de la Résistance se retrouvèrent sans ennemi contre qui s'unir. La dépression et les questions existentielles les terrassèrent.,"Члены Сопротивления, оставшись без сплотившего их врага, приуныли и начали задумываться о вопросах жизни и смерти.","저항 세력은 적을 모으지 않고 스스로를 찾아 나섰고, 모든 우울증과 존재감을 가지고 있었습니다."
HatGoneEndingDialog4,"So in other words, congratulations on finding the ""bad ending"".",,"Así que en otras palabras, felicitaciones por encontrar el ""final malo"".",换句话说，恭喜你达成了“糟糕的结局”。,"Mit anderen Worten, herzlichen Glückwunsch: Du hast das „schlechte Ende“ gefunden.","Em outras palavras, parabéns por chegar ao ""final ruim"".","Donc, en d'autres termes, félicitations : vous avez trouvé la ""mauvaise fin"".","Короче говоря, поздравляем: тебе удалось найти плохую концовку.","다시 말하면, ""나쁜 결말""을 찾는 것을 치하합니다."
HatGoneEndingDialog5,"There will be no ""partying down"" for you!  Not this time!",,¡No habrá nada de fiesta para ti! ¡No esta vez!,不会有“狂欢”了！这次不行！,Für dich gibt es keine „Feier“! Dieses Mal nicht!,"Não haverá ""festa"" para você! Não desta vez!",Pas de fête pour vous ! Pas cette fois !,Никаких вечеринок тебе! В этот раз уж точно!,"당신을 위해 ""파티""는 없을 것입니다! 이번엔 아니에요!"
EndingNoOneNearby1,"Unfortunately, there was no one around to hear the new mayor's speech.  Bummer.",,"Desafortunadamente, no había nadie alrededor para escuchar el discurso del nuevo alcalde. Qué mala onda.",遗憾的是，周围没有人倾听新市长的演讲。真气人。,"Leider gab es niemanden in der Nähe, der die Rede des neuen Bürgermeisters hören konnte. Sowas Dummes.","Infelizmente, não há ninguém por perto para ouvir o discurso do novo prefeito. Que saco.","Malheureusement, il ne restait plus personne pour écouter le discours du nouveau maire. Dommage.","К сожалению, вокруг не оказалось никого, кто мог бы услышать речь нового мэра. И это грустно.","불행하게도 새로운 시장의 연설을 듣는 사람은 아무도 없었습니다, 버머."
EndingNoOneNearby2,Or at least that's what would have happened if there were actually enough people around for a party.  Mega bummer.,,O al menos eso es lo que hubiera pasado si en realidad hubiera habido suficientes personas como para hacer una fiesta. Mega mala onda.,如果周围有足够的人来举办派对，至少会出现那种情况。真是太气人了。,"Oder jedenfalls wäre es so passiert, wenn tatsächlich genug Leute in der Nähe gewesen wären für eine richtige Party. So ein Mist.","Ou, pelo menos, era isso que teria acontecido se tivessem gente suficiente para uma festa. Que mega saco.",Ou c'est plutôt ce qu'il se serait passé s'il était resté assez de monde pour une fête. Super dommage.,"Или, по крайней мере, так случилось бы, окажись рядом достаточно людей, чтобы устроить вечеринку. И это ужас как грустно.",적어도 파티를 하기에 충분한 사람들이 있다면 적어도 그렇게 되었을 것입니다. 메가 버머.
EndingNoOneNearby3,"Unfortunately, turnout for the new mayor's speech was so low that the whole thing was canceled.  Bummer.",,"Desafortunadamente, la concurrencia al discurso del nuevo alcalde fue tan baja que cancelaron todo. Qué mala onda.",遗憾的是，新市长的演讲太低端了，结果演讲被取消了。真气人。,"Leider kamen nur so wenige Zuhörer zur Rede des neuen Bürgermeisters, dass die ganze Sache abgeblasen wurde. So ein Pech.","Infelizmente, o público para assistir o discurso do prefeito era tão pequeno que todo o negócio foi cancelado. Que saco.","Malheureusement, le public assemblé pour le discours du nouveau maire était si réduit que tout fut annulé. Dommage.","К сожалению, речь мэра оказалась настолько плохой, что все мероприятие отменили. Такая беда.",아쉽게도 새로운 시장의 연설에 대한 투표율은 너무 낮아 모든 것이 취소되었습니다. 버머.
EndingDialogCustom,The Mayor gave a rousing speech that filled the citizens with hope for a brighter future.,,El alcalde pronunció un encendido discurso que llenó a los ciudadanos de esperanza por un futuro más auspicioso.,市长发表了激动人心的讲话，让市民充满希望，共创美好未来。,"Der Bürgermeister hielt eine mitreißende Rede, die die Bürger mit Hoffnung auf eine bessere Zukunft erfüllte.",O prefeito fez um discurso empolgante que encheu os cidadãos com esperança de um futuro melhor.,Le maire prononça un discours encourageant qui emplit les citoyens d'espoir pour un avenir meilleur.,"Мэр выступил с воодушевляющей речью, наполнившей горожан надеждой на светлое будущее.",시장은 더 밝은 미래에 대한 희망을 시민들에게 심어주는 열띤 연설을 했습니다.
NA_NeedMoreControllers,You'll need to plug in more controllers first.,,Tendrás que enchufar más mandos primero.,你需要先插入更多控制器。,Du musst zuerst mehr Controller anschließen.,Primeiro você precisa conectar mais controles.,Vous allez devoir d'abord brancher plus de manettes.,Сначала нужно будет подключить еще контроллеры.,먼저 컨트롤러를 추가로 연결해야 합니다.
NA_NoRecordsToPlay,I don't have anything to play.,,No tengo nada para reproducir.,没有要播放的东西。,Ich habe nichts zum Spielen.,Não tenho nada para jogar.,Je n'ai rien pour jouer.,Мне нечего играть.,플레이할 게 없어요.
NA_GotFreeItem,That's on the house.,,Esto va por cuenta de la casa.,这件免费。,Das geht aufs Haus.,Este é por conta da casa.,Tournée du patron.,Это за счёт заведения.,그게 집에 있어요.
NA_CantUpgradeTrait,I don't have any traits I can upgrade.,,No tengo ningún rasgo que pueda mejorar.,没有可以升级的特性。,"Ich habe keine Eigenschaften, die ich verbessern könnte.",Não tenho nenhuma característica que eu possa aprimorar.,Je n'ai pas de trait à améliorer.,"Нет особенностей, которые можно улучшить.",저는 업그레이드할 수 있는 특성이 없습니다.
NA_CantRemoveTrait,I don't have any traits I can remove.,,No tengo ningún rasgo que pueda quitar.,没有可以移除的特性。,"Ich habe keine Eigenschaften, die ich entfernen könnte.",Não tenho nenhuma característica que eu possa remover.,Je n'ai pas de trait à supprimer.,"Нет особенностей, которые можно убрать.",저는 제거할 수 있는 특성이 없습니다.
NA_CantChangeTraitRandom,I don't have any traits I can swap.,,No tengo ningún rasgo que pueda intercambiar.,没有可以交换的特性。,"Ich habe keine Eigenschaften, die ich tauschen könnte.",Não tenho nenhuma característica que eu possa trocar.,Je n'ai pas de trait à échanger.,"Нет особенностей, которые можно сменить.",저는 교환할 수 있는 특성이 없습니다.
NA_CantChangeTraitRandomEquivalent,There aren't any traits I can swap out for this one.,,No hay ningún rasgo que pueda intercambiar por este.,没有可以用于和该特性交换的特性。,"Es gibt keine Eigenschaften, die ich gegen diese hier eintauschen könnte.",Não há nenhuma característica que eu possa trocar por este.,Aucun trait ne peut être échangé contre celui-là.,"Нет особенностей, которые можно сменить на эту.",이것과 교환할 수 있는 특성이 없습니다.
NA_CantAugmentPossessing,I need to be in my own body to use this.,,Necesito estar en mi propio cuerpo para usar esto.,我需要回到自己的身体才能使用它。,"Ich muss in meinem eigenen Körper sein, um das zu benutzen.",Preciso estar em meu próprio corpo para usar isto.,Je dois être dans mon propre corps pour utiliser cela.,"Чтобы использовать это, мне нужно быть в своем теле.",이걸 사용하려면 내 몸에 있어야 합니다.
NA_BarbecueBurntOut,The charcoal is all burnt out.,,El carbón está todo quemado.,木炭烧光了。,Die Kohle brennt nicht mehr.,O carvão está todo queimado.,Le charbon est tout consumé.,Уголь совсем выгорел.,숯이 모두 타버렸습니다.
NA_CantUseFireHydrant,I don't have any use for this.,,No tengo ningún uso para esto.,这东西对我没用。,Ich kann das nicht benutzen.,Não tenho nenhuma utilidade para isso.,Ce truc ne me sert à rien.,Это некуда применить.,이것을 작동할 수 있는 방법이 없습니다.
NA_CantSetSeed,"Sorry, only Player 1 can set the seed!",,"¡Lo siento, solo el Jugador 1 puede definir la semilla!",抱歉，只有玩家 1 可以设置种子！,"Entschuldigung, nur Spieler 1 kann das Level einstellen!","Sinto muito, apenas o Jogador 1 pode definir o seed!","Désolé, seul le joueur 1 peut définir la série !",Только игрок 1 может задавать начальное число!,플레이어 1만 시드를 설정할 수 있습니다!
Firefighter_Win1,"Now that I have your attention, I'd like to talk to you a little bit about fire safety.",,"Ahora que tengo tu atención, me gustaría hablarte un poco sobre manejo responsable del fuego.",请注意，我想和你谈谈消防问题。,"Nun, da ich eure Aufmerksamkeit habe, möchte ich gern mit euch über Brandschutz sprechen.","Agora que tenho sua atenção, eu gostaria de falar com você um pouco sobre a Segurança contra incêndio.","Maintenant que j'ai attiré votre attention, j'aimerais vous parler un peu de la sécurité incendie.","Итак, теперь ты меня слушаешь. Я хочу немного поговорить о пожарной безопасности.","당신의 관심을 끌었으니, 화재 안전에 관해 조금 이야기하고 싶습니다."
Firefighter_Win2,"If you're going to start a fire, don't do it around the Cops, because they'll beat you up.",,"Si vas a encender un fuego, no lo hagas cerca de los policías, porque te darán una paliza.",如果你想放火，那么请避开警察，因为他们会把你痛扁一顿。,"Wenn ihr ein Feuer macht, dann tut das nicht in der Nähe von Polizisten, die werden euch verprügeln.","Se você for começar um incêndio, não faça isso perto dos Policiais, porque eles acabarão com você.","Si vous comptez allumer un feu, ne le faites pas à proximité de la police parce qu'ils vont vous passer à tabac.","Если собираешься разжечь огонь, отойди подальше от копов, иначе они тебя побьют.",불을 붙일 예정이라면 경찰 주위에서 하지 마십시오. 왜냐하면 당신을 두들겨 팰 거예요.
Firefighter_Win3,"Also, don't bump into a fire when you have less than 10 health left, it's seriously not worth it.",,"Además, no te des contra un fuego cuando te queden menos de 10 puntos de vida, realmente no vale la pena.",还有，如果你的生命值不足 10，请勿接近火。这一点都不值。,"Berührt auch kein Feuer, wenn ihr weniger als 10 Gesundheitspunkte habt, das ist es wirklich nicht wert.","Além disso, não bata no fogo quando você estiver com menos de 10 de energia restante, sério... não vale a pena.","En outre, ne sautez pas un feu quand vous avez moins de 10 points de vie. Ça ne vaut vraiment pas le coup.","И еще: не влазь в огонь, если осталось меньше 10 единиц здоровья — оно правда того не стоит.",또한 건강 상태가 10 점 미만인 경우 불을 접하지 말아야 합니다. 그럴 가치가 없습니다.
Alien_Interact_1,Hello earthling.  It's pretty dope that you understand me.  Your city is still a dump.,,Hola terrícola. Es realmente genial que me entiendas. Tu ciudad sigue siendo un basurero.,你好，地球人。你能听懂我的话真是太酷了。不过你们的城市依然是个垃圾场。,"Hallo, Erdling. Ziemlich cool, dass du mich verstehen kannst. Aber deine Stadt ist immer noch eine Müllhalde.","Olá, terráqueo. É muito maneiro você me entender. Sua cidade continua um lixo.","Bonjour, terrien. C'est cool que vous me compreniez. Votre ville est toujours un tas d'ordure.","Привет, землянин. Прикольно, что ты меня понимаешь. Город все еще — большая свалка.",안녕하세요. 당신이 나를 이해한다는 것은 대단한 큰 일입니다. 당신의 도시는 여전히 쓰레기 더미입니다.
Athlete_Interact_1,"You wouldn't happen to have any lunch money, would ya?",,"No tendrás dinero para el almuerzo, ¿no?",你身上不会恰巧有午餐钱吧？,Du hast nicht zufällig ein bisschen Geld fürs Mittagessen oder?,"Você não teria dinheiro para comprar almoço, teria?","Tu n'aurais pas de l'argent pour le déjeuner, par hasard ?",У тебя случайно не найдется денег на обед?,점심 먹을 돈 없나요. 있죠?
Athlete_Interact_2,I get depressed when I'm not running into things.,,Me deprimo cuando no estoy chocando contra cosas.,不碰倒东西，我就会感到很沮丧。,"Ich werde depressiv, wenn ich nicht in Dinge hineinlaufe.",Eu fico deprimido quando não estou batendo nas coisas.,Ça me déprime de ne foncer dans rien.,"Я впадаю в уныние, когда чего-то не догоняю.",뭔가 하지 않으면 우울해져요.
Athlete_Interact_3,NERRRRRDS!!!,,¡¡¡NEEEERRRDS!!!,呆子！！,NERRRRRDS!!!,NERRRRRDS!!!,NERRRRRDS !!!,БОТА-А-АНИКИ!!!,얼~간~이~!
Athlete_Interact_4,Is it possible to be so concussed that your brain rattles around a little bit?,,¿Es posible tener una conmoción cerebral tan grande que tu cerebro vibre un poco dentro de tu cráneo?,有没有可能脑震荡太严重，导致脑子吱嘎吱嘎响？,"Ist es möglich, eine so starke Gehirnerschütterung zu erleiden, dass das Gehirn ein bisschen herumgeistert?",É possível ficar tão confuso que seu cérebro chacoalha um pouco?,C'est possible d'être tellement commotionné que le cerveau remue un peu tout seul ?,"Можно ли получить такое сотрясение, что мозг будет постоянно немного дребезжать?",뇌진탕이 되어 머리가 약간 흔들리는 게 있을 수 있나요?
Businessman_Interact_1,"Got any cash?  No reason, I'd just rather I have it than you.",,"¿Tienes dinero? Por ningún motivo, simplemente que preferiría tenerlo yo antes que tú.",有现金吗？没什么理由，我只是想把它从你身上抢过来。,"Hast du ein bisschen Geld? Einfach nur so, weil ich es lieber hätte als du.","Conseguiu algum dinheiro? Por nenhuma razão, eu só preferiria ficar com ele em vez de você.","Vous avez du liquide ? Non, non, rien. Je préfère juste en avoir à votre place.","Деньги есть? Ни на что, просто так. Лучше, чтобы они были у меня, а не у тебя.","현금 가져 왔어요? 이유가 없어요, 내가 갖고 있는 게 낫겠어요."
Businessman_Interact_2,"Money can't buy happiness, but it also can't buy clouds.  Profound thoughts!",,"El dinero no puede comprar la felicidad, pero tampoco puede comprar nubes. ¡Pensamientos profundos!",金钱买不到幸福，但它也买不到云彩。好深刻的思想！,"Mit Geld kann man kein Glück kaufen, aber auch keine Wolken. Tiefgründige Gedanken!","Dinheiro não pode comprar felicidade, mas ele também não pode comprar nuvens. Pensamentos profundos!","L'argent n'achète pas le bonheur, mais il ne peut pas non plus acheter les nuages. C'est tellement profond !","Счастья за деньги не купишь, но и облака тоже. Глубокая мысль!",돈은 행복을 살 수 없고 구름을 살 수 없습니다. 심오한 생각!
Businessman_Interact_3,My Uncle Denny told me to invest in gas.  Then he farted on me.,,Mi tío Dani me recomendó invertir en gas. Luego me tiró un pedo.,我叔叔丹尼告诉我要投资天然气。然后他骗了我。,"Mein Onkel Denny sagte mir, ich solle in Gas investieren. Dann furzte er mich an.",Meu Tio Denny me disse para investir em gás. Depois ele peidou em mim.,Mon oncle Denny m'a dit d'investir dans le gaz. Puis il m'a pété dessus.,Мой дядюшка Денни сказал мне вкладывать в газ… и пукнул в меня.,삼촌 데니가 가스에 투자하라고 했어요. 그리고 저를 향해 방귀를 뀌었어요.
Comedian_Interact_1,"Derp de derp?..  Sorry, sometimes I forget how to have a normal interaction.",,"¿Tipo de tipo?... Disculpa, a veces olvido cómo interactuar de forma normal.",Derp de derp？对不起，有时候我会忘记如何进行正常的互动。,"Trotteliger de Trottel?... Entschuldigung, manchmal vergesse ich, wie die normale Interaktion funktioniert.","Loucura loucura?... Desculpa, às vezes esqueço de como ter uma interação normal.","Derp de derp ?.. Désolé, il m'arrive d'oublier comment avoir une interaction normale.","Бла бла-бла?.. Ох, прости. Иногда я забываю, как разговаривают нормальные люди.",더프 더 더프?... 때로는 정상적인 상호 작용을 잊는 경우가 있습니다.
Comedian_Interact_2,"Writing one-liners is hard, I pity the poor schlub who has to do it.",,"Escribir chistes es difícil, siento lástima por el pobre idiota que se tiene que ganar la vida haciéndolo.",写段子很难，我可怜那个不得不做这项工作的蠢货。,"Einzeiler zu schreiben ist wirklich schwierig, ich bemitleide den armen Tölpel, der sich damit auseinandersetzen muss.","Escrever piadas é difícil, tenho pena do coitado que tem que ganhar a vida fazendo isso.",Écrire des one-liners est difficile. Je plains le couillon qui doit le faire.,"Писать коротки шутки сложно. Жаль тех сопляков, которым приходится это делать.",단 하나의 라이너를 쓰는 것은 어렵습니다. 그것을 해야만 하는 가난한 슐럽을 불쌍히 생각합니다.
Comedian_Interact_3,"If one exists only to tell jokes, does that make one a joke themselves?",,"Si uno existe solo para contar chistes, ¿eso lo vuelve a uno mismo un chiste?",如果一个人的生存目的只是为了讲笑话，那他本人是不是也只是个笑话？,"Wenn jemand nur existiert, um Witze zu erzählen, macht ihn das selbst zu einem Witz?","Se sua existência limita-se a contar piadas, isso torna você uma piada?","Si on n'existe que pour raconter des blagues, cela veut-il dire qu'on est une blague en soi ?","Если единственная цель твоего существования — шутить, становишься ли ты сам шуткой?","농담을 하는 것이 존재한다면, 스스로 농담을 만들 수 있습니까?"
Cannibal_Interact_1,"This bum told me he hadn't had a bite in days, so I bit him.  True story.",,"Este vagabundo me dijo que no había probado ni un mordisco en días, así que lo mordí. Es gracioso porque es real.",这个流浪汉说他好几天都没吃过东西了，所以我赏了他一口。真的。,"Dieser Penner sagte mir, er hätte seit Tagen keinen Bissen mehr gehabt, also biss ich ihn. So war es.","Este mendigo me disse que não mordia nada há dias, então eu mordi ele. Isso aconteceu de verdade.","Ce clodo m'a dit qu'il n'avait rien eu à se mettre sous la dent depuis des jours, donc je l'ai mis sous la mienne. C'est vrai.","Один жаловался тут: цены кусаются. Ну так я его укусил — чтобы знал, что не только цены. Зуб даю.",이 부랑자는 그가 며칠 만에 물지 않았다고 말했기 때문에 내가 그를 물었습니다. 실화.
Cannibal_Interact_2,It sucks not being able to post pictures of my meals online.,,Qué mierda no poder publicar fotos de mis comidas en línea.,不能在网上发布我的美餐照片，真是太扯了。,"Es ist doch echt doof, dass ich keine Bilder meiner Mahlzeiten im Internet veröffentlichen kann.",Uma pena não puder publicar fotos de minhas refeições on-line.,Ça craint de ne pas pouvoir publier de photos de mes repas.,"Жизнь — отстой: я не могу публиковать фотки своей еды, как все.",나의 식사를 온라인에 포스트할 수 없는 것이 아쉽군요.
Cannibal_Interact_3,Hiding in bushes to wait for victims can be a great time for meditation!,,¡Esconderse en los arbustos a la espera de víctimas puede ser un buen momento para la meditación!,躲在灌木丛中等待受害者出现特别适合冥想！,"Während man sich in Büschen versteckt, um auf Opfer zu warten, kann man sehr gut meditieren!",Esconder-se nos arbustos para esperar por vítimas pode ser um bom momento para meditação!,"Se cacher dans des buissons, à l'affût de victimes, rien de tel pour la méditation !","Лучшее время для медитации — когда прячешься в кустах, поджидая жертву!",덤불에 숨어서 희생자를 기다리는 것은 명상을 위한 좋은 시간이 될 수 있습니다!
Firefighter_Interact_1,Know what I hate more than fire?  The monstrous caveman who invented it.,,¿Sabes qué odio más que el fuego? Al maldito cavernícola que lo inventó.,你知道有什么比火让我更讨厌吗？就是发明钻木取火的那群原始人。,"Wisst ihr, was ich noch mehr hasse als Feuer? Den abscheulichen Höhlenmenschen, der es erfunden hat.",Sabe o que odeio mais do que fogo? O terrível homem das cavernas que o inventou.,Savez ce que je hais plus que le feu ? Le crétin des cavernes qui l'a inventé.,"Знаешь, что я ненавижу больше пожаров? Того пещерного придурка, который додумался пользоваться огнем.",내가 불보다 더 싫어하는 것을 알아? 그것을 발명한 기괴한 원시인.
Firefighter_Interact_2,This water cannon on my arm means I can shower literally anytime!,,¡Este cañón de agua en mi brazo significa que puedo darme una ducha literalmente en cualquier momento!,有了手上这支防暴水枪，我就可以随时洗澡了！,"Diese Wasserkanone an meinem Arm bedeutet, dass ich praktisch jederzeit duschen kann!","Este canhão de água em meu braço significa que posso tomar um banho, literalmente, a qualquer momento!",Le canon à eau que j'ai sur le bras veut dire que je peux littéralement me doucher quand je veux !,С водометом в руках я могу принимать душ буквально когда захочу!,팔에 있는 이 물대포는 언제든지 문자 그대로 샤워할 수 있음을 의미합니다!
